{
  "version": "2.0",
  "world": {
    "gravity": [0, -9.81, 0],
    "up_axis": "y",
    "unit": "meters"
  },
  "ground": {
    "type": "plane",
    "normal": [0, 1, 0],
    "y": -0.02,
    "material": { "friction": 0.85, "restitution": 0.1 }
  },
  "objects": [
    {
      "id": "chair_01",
      "class": "chair",
      "mesh": "meshes/chair_01.glb",
      "transform": {
        "translation": [0.42, 0.0, 1.13],
        "rotation_quat": [0, 0, 0, 1],
        "scale": 1.0
      },
      "collider": {
        "shape": "hulls",
        "convex_decomposition": true,
        "hull_paths": ["hulls/chair_01_0.glb", "hulls/chair_01_1.glb"]
      },
      "physics": { "mass_kg": 5.6, "friction": 0.45, "restitution": 0.2, "is_rigid": true },
      "material_class": "wood",
      "source": {
        "geometry_source": "generative",
        "alignment_method": "fpfh_icp",
        "scale_method": "per_axis_median",
        "physics_origin": "vlm",
        "vlm_reasoning": "visible wood grain, standard chair construction"
      }
    },
    {
      "id": "sports_ball_00",
      "class": "sports ball",
      "mesh": "meshes/sports_ball_00.glb",
      "transform": {
        "translation": [0.10, 0.62, 0.80],
        "rotation_quat": [0, 0, 0, 1],
        "scale": 1.0
      },
      "collider": {
        "shape": "box",
        "half_extents": [0.11, 0.11, 0.11]
      },
      "physics": { "mass_kg": 0.42, "friction": 0.8, "restitution": 0.75, "is_rigid": true },
      "material_class": "rubber",
      "source": {
        "geometry_source": "generative",
        "alignment_method": "fpfh_icp",
        "scale_method": "per_axis_median",
        "physics_origin": "lookup",
        "vlm_reasoning": ""
      }
    },
    {
      "id": "dining_table_02",
      "class": "dining table",
      "mesh": "meshes/dining_table_02.glb",
      "transform": {
        "translation": [-0.60, 0.0, 0.90],
        "rotation_quat": [0, 0, 0, 1],
        "scale": 1.0
      },
      "collider": {
        "shape": "hulls",
        "convex_decomposition": true,
        "hull_paths": ["hulls/dining_table_02_0.glb"]
      },
      "physics": { "mass_kg": 14.8, "friction": 0.5, "restitution": 0.1, "is_rigid": true },
      "material_class": "wood",
      "source": {
        "geometry_source": "tsdf",
        "alignment_method": "n/a",
        "scale_method": "n/a",
        "physics_origin": "vlm",
        "vlm_reasoning": "matte wooden finish, four-leg dining table"
      }
    }
  ],
  "camera_pose": {
    "translation": [0, 1.2, 0],
    "rotation_quat": [0, 0, 0, 1]
  }
}
